{
  "$schema": "../fixtures.schema.json",
  "chainId": 11155111,
  "accounts": {
    "sender": "0x1111111111111111111111111111111111111111",
    "recipient": "0x2222222222222222222222222222222222222222",
    "delegate": "0x3333333333333333333333333333333333333333"
  },
  "contracts": {
    "acl": "0xf0Ffdc93b7E186bC2f8CB3dAA75D86d1930A433D",
    "decryptionVerifier": "0x5D8BD78e2ea6bbE41f26dFe9fdaEAa349e077478",
    "underlyingToken": "0x9b5Cd13b8eFbB58Dc25A05CF411D8056058aDFfF",
    "confidentialToken": "0x7c5BF43B851c1dff1a4feE8dB225b87f2C223639"
  },
  "values": {
    "amount": "2500000",
    "encryptedHandle": "0xabababababababababababababababababababababababababababababababab",
    "inputProof": "0xcdcdcdcdcdcdcdcdcdcdcdcdcdcdcdcdcdcdcdcdcdcdcdcdcdcdcdcdcdcdcdcdcdcdcdcdcdcdcdcdcdcdcdcdcdcdcdcdcdcdcdcdcdcdcdcdcdcdcdcdcdcdcdcd",
    "startTimestamp": "1770000000",
    "durationDays": "30",
    "expirationDate": "1780000000"
  },
  "calldata": [
    {
      "operation": "delegateDecryption",
      "descriptor": "../experimental/zama/calldata-acl-user-decryption.json",
      "to": "0xf0Ffdc93b7E186bC2f8CB3dAA75D86d1930A433D",
      "function": "delegateForUserDecryption(address delegate,address contractAddress,uint64 expirationDate)",
      "data": "0x04f61a9500000000000000000000000033333333333333333333333333333333333333330000000000000000000000007c5bf43b851c1dff1a4fee8db225b87f2c223639000000000000000000000000000000000000000000000000000000006a18a500",
      "expectedTexts": [
        "Grant decrypt access",
        "Delegate wallet",
        "Conf. contract",
        "Delegation expires",
        "No spending or transfer permission"
      ]
    },
    {
      "operation": "shieldApprove",
      "descriptor": "../experimental/zama/calldata-erc20-shield-entrypoints.json",
      "to": "0x9b5Cd13b8eFbB58Dc25A05CF411D8056058aDFfF",
      "function": "approve(address spender,uint256 amount)",
      "data": "0x095ea7b30000000000000000000000007c5bf43b851c1dff1a4fee8db225b87f2c22363900000000000000000000000000000000000000000000000000000000002625a0",
      "expectedTexts": ["Approve shield wrapper", "Wrapper", "Approval amount"]
    },
    {
      "operation": "shieldTransferAndCall",
      "descriptor": "../experimental/zama/calldata-erc20-shield-entrypoints.json",
      "to": "0x9b5Cd13b8eFbB58Dc25A05CF411D8056058aDFfF",
      "function": "transferAndCall(address to,uint256 value,bytes data)",
      "data": "0x4000aea00000000000000000000000007c5bf43b851c1dff1a4fee8db225b87f2c22363900000000000000000000000000000000000000000000000000000000002625a0000000000000000000000000000000000000000000000000000000000000006000000000000000000000000000000000000000000000000000000000000000142222222222222222222222222222222222222222000000000000000000000000",
      "expectedTexts": ["Shield public tokens", "Wrapper", "Amount", "Shield recipient data"]
    },
    {
      "operation": "shieldWrap",
      "descriptor": "../experimental/zama/calldata-confidential-token-wrapper.json",
      "to": "0x7c5BF43B851c1dff1a4feE8dB225b87f2C223639",
      "function": "wrap(address to,uint256 amount)",
      "data": "0xbf376c7a000000000000000000000000222222222222222222222222222222222222222200000000000000000000000000000000000000000000000000000000002625a0",
      "expectedTexts": ["Shield public tokens", "Recipient", "Amount"]
    },
    {
      "operation": "confidentialTransfer",
      "descriptor": "../experimental/zama/calldata-confidential-token-wrapper.json",
      "to": "0x7c5BF43B851c1dff1a4feE8dB225b87f2C223639",
      "function": "confidentialTransfer(address to,bytes32 encryptedAmount,bytes inputProof)",
      "data": "0x2fb74e620000000000000000000000002222222222222222222222222222222222222222abababababababababababababababababababababababababababababababab00000000000000000000000000000000000000000000000000000000000000600000000000000000000000000000000000000000000000000000000000000040cdcdcdcdcdcdcdcdcdcdcdcdcdcdcdcdcdcdcdcdcdcdcdcdcdcdcdcdcdcdcdcdcdcdcdcdcdcdcdcdcdcdcdcdcdcdcdcdcdcdcdcdcdcdcdcdcdcdcdcdcdcdcdcd",
      "expectedTexts": ["Send confidential tokens", "Recipient", "[Encrypted confidential amount]"]
    },
    {
      "operation": "unwrap",
      "descriptor": "../experimental/zama/calldata-confidential-token-wrapper.json",
      "to": "0x7c5BF43B851c1dff1a4feE8dB225b87f2C223639",
      "function": "unwrap(address from,address to,bytes32 encryptedAmount,bytes inputProof)",
      "data": "0x5bf4ef0600000000000000000000000011111111111111111111111111111111111111110000000000000000000000002222222222222222222222222222222222222222abababababababababababababababababababababababababababababababab00000000000000000000000000000000000000000000000000000000000000800000000000000000000000000000000000000000000000000000000000000040cdcdcdcdcdcdcdcdcdcdcdcdcdcdcdcdcdcdcdcdcdcdcdcdcdcdcdcdcdcdcdcdcdcdcdcdcdcdcdcdcdcdcdcdcdcdcdcdcdcdcdcdcdcdcdcdcdcdcdcdcdcdcdcd",
      "expectedTexts": ["Request unshield", "Public recipient", "[Encrypted unshield amount]"]
    },
    {
      "operation": "unwrapAll",
      "descriptor": "../experimental/zama/calldata-confidential-token-wrapper.json",
      "to": "0x7c5BF43B851c1dff1a4feE8dB225b87f2C223639",
      "function": "unwrap(address from,address to,bytes32 amount)",
      "data": "0xe8c15fd400000000000000000000000011111111111111111111111111111111111111110000000000000000000000002222222222222222222222222222222222222222abababababababababababababababababababababababababababababababab",
      "expectedTexts": ["Request full-balance unshield", "Public recipient", "Balance handle"]
    },
    {
      "operation": "finalizeUnwrap",
      "descriptor": "../experimental/zama/calldata-confidential-token-wrapper.json",
      "to": "0x7c5BF43B851c1dff1a4feE8dB225b87f2C223639",
      "function": "finalizeUnwrap(bytes32 unwrapRequestId,uint64 burntAmountCleartext,bytes decryptionProof)",
      "data": "0x5bb67a05abababababababababababababababababababababababababababababababab00000000000000000000000000000000000000000000000000000000002625a000000000000000000000000000000000000000000000000000000000000000600000000000000000000000000000000000000000000000000000000000000040cdcdcdcdcdcdcdcdcdcdcdcdcdcdcdcdcdcdcdcdcdcdcdcdcdcdcdcdcdcdcdcdcdcdcdcdcdcdcdcdcdcdcdcdcdcdcdcdcdcdcdcdcdcdcdcdcdcdcdcdcdcdcdcd",
      "expectedTexts": ["Finalize unshield", "Clear amount", "Unshield request"]
    }
  ],
  "eip712": [
    {
      "operation": "allow",
      "descriptor": "../experimental/zama/eip712-decryption-permits.json",
      "data": {
        "domain": {
          "name": "Decryption",
          "version": "1",
          "chainId": 11155111,
          "verifyingContract": "0x5D8BD78e2ea6bbE41f26dFe9fdaEAa349e077478"
        },
        "types": {
          "UserDecryptRequestVerification": [
            {
              "name": "publicKey",
              "type": "bytes"
            },
            {
              "name": "contractAddresses",
              "type": "address[]"
            },
            {
              "name": "startTimestamp",
              "type": "uint256"
            },
            {
              "name": "durationDays",
              "type": "uint256"
            },
            {
              "name": "extraData",
              "type": "bytes"
            }
          ]
        },
        "primaryType": "UserDecryptRequestVerification",
        "message": {
          "publicKey": "0x1234",
          "contractAddresses": ["0x7c5BF43B851c1dff1a4feE8dB225b87f2C223639"],
          "startTimestamp": "1770000000",
          "durationDays": "30",
          "extraData": "0x"
        }
      },
      "expectedTexts": ["Decrypt access", "Conf. contract", "Starts", "Duration"]
    },
    {
      "operation": "allowAs",
      "descriptor": "../experimental/zama/eip712-decryption-permits.json",
      "data": {
        "domain": {
          "name": "Decryption",
          "version": "1",
          "chainId": 11155111,
          "verifyingContract": "0x5D8BD78e2ea6bbE41f26dFe9fdaEAa349e077478"
        },
        "types": {
          "DelegatedUserDecryptRequestVerification": [
            {
              "name": "publicKey",
              "type": "bytes"
            },
            {
              "name": "contractAddresses",
              "type": "address[]"
            },
            {
              "name": "delegatorAddress",
              "type": "address"
            },
            {
              "name": "startTimestamp",
              "type": "uint256"
            },
            {
              "name": "durationDays",
              "type": "uint256"
            },
            {
              "name": "extraData",
              "type": "bytes"
            }
          ]
        },
        "primaryType": "DelegatedUserDecryptRequestVerification",
        "message": {
          "publicKey": "0x1234",
          "contractAddresses": ["0x7c5BF43B851c1dff1a4feE8dB225b87f2C223639"],
          "delegatorAddress": "0x1111111111111111111111111111111111111111",
          "startTimestamp": "1770000000",
          "durationDays": "30",
          "extraData": "0x"
        }
      },
      "expectedTexts": [
        "Delegated decrypt",
        "Delegator wallet",
        "Conf. contract",
        "Starts",
        "Duration"
      ]
    }
  ]
}
